min_margin,contest_name,contest_cvr_ids
700,Logan - Proposition 120 (STATUTORY),"[1311472,1312322,1314168,1314402,1310479,1311835,1311123,1313411,1310214,1315403,1312711,1315283,1310084,1311490,1315174,1314097,1313112,1314225,1313467,1314591,1310698,1311499,1311271,1315443,1311412,1310179,1313592,1310655,1315079,1313993,1314002,1312170,1311902,1314911,1311593,1310699,1309961,1314535,1312741,1310091,1315330,1313741,1315292,1315489,1315192,1314097,1313170,1313439,1309933,1315003,1315111,1310018,1312914,1313400,1312650,1309697,1312972,1313142,1312679,1313048,1312949,1312438,1312924]"
0,Joint School District No. 23JT Director - 4 Year Term,[]
0,City of Northglenn Council Member - Ward 4 - 4 Year Term,[]
0,Alamosa School District RE-11J Director District 3,[]
0,Alamosa School District RE-11J Director District 4,[]
0,City of Las Animas City Council Ward 1 - Precinct 10,[]
314,Moffat County School Board Director - District B,"[1305875,1306450,1304487,1306664,1307125,1307216,1307971,1306544,1308275,1305422,1305854,1305090,1306005,1306765,1307838,1307154,1305564,1306132,1307684,1305300,1306630,1307449,1307851,1308025,1305310,1305631,1305760,1305291,1306544,1305599,1305308,1308029,1305695,1305830,1306968,1304787,1307702,1307274,1306309,1306256,1306524,1305713,1304644,1305538,1304951,1307929,1308115,1306676,1306647,1304443,1304466,1305466,1304356,1304252,1305549,1308161,1306420,1307180,1308186,1305851,1305137,1306034,1305299,1305426,1305674,1307345,1305747,1304646,1307814,1307292,1306821,1305745,1304796,1305682,1305342,1305408,1307856,1305296,1307549,1307578,1308203,1307060,1305088,1304469,1305085,1307469,1307750,1307867,1306884,1308003,1307605,1307654,1306906,1307190,1304514,1306740,1306795]"
1068,City of Thornton Council Member - Ward 3,"[566512,594382,589820,567312,589607,639246,636100,618381,656696,631120,658168,614967,619662,619880,625231,611316,641436,633734,631463,608396,659362,657244,654409,604357,633471,573562,623304,634997,602286,649205,577268,609656,580577,582978,592452,573012,657012,597947,651592,649437,567549,587340,586255,580225,586409,578465,625738,584685,640097,645257,608123,614893,625229,580083,636001,625012,629055,598691,595822,619541,624010,588669,611626,632153,642630,654740,626576,587301,575846,618861,593378,620485,605861,602301,571419,584339,618708,638493,595137,569927,638272,634062,584099,574418,647133,594259,566363,635886,617802,618813,592722,654869,642299,595659,610935,635475,584069,638768,641878,575384,617086,647405,623618,654500,654543,624400,608006,593742,645761,579668,606764,623150,644399,568842,628318,569155,627332,566545,646346,621516,568471,571612,607529,568765,593354,615358,631365,583887,627063,641305,603912,630378,596567,623409,617146,624239,591049,567918,630208,621577,616195,608755,646912,602002,649320,653034,626248,656671,615911,582476,607489,623886,649223,611269,622427,600403,618036,619969,598321,609660,583010,635795,621084,627383,615222,622320,632100,621423,646585,600017,645928,568165,594070,596688,619497,630945,642158,631251,638160,593525,605200,635799,649029,628558,606306,644152,595667,579112,622612,602963,597624,641146,635154,643420,573961,653760,574493,577282,631403,645912,613341,649402,607520,578944,577880,625360,614209,622322,632367,645700,652331,657719,583005,594713,636476,599722,618207,651406,601696,653702,608136,575627,610663,598153,657086,645657,576583,569575,608916,655091,655044,580246,623090,584724,616411,621600,613366,595441,632905,652858,640386,618602,639659,622619,616136,633487,622537,619943,621648,599294,627970,576806,593055,656543,569921,618885,622517,598253,569049,655840,636154,591498,639623,608824,613930,647782,621630,643831,627378,655786,643455,627895,572652,567031,577988,611159,591701,641586,613553,619715,581441,618824,656188,627365,584062,610312,573368,616951,626481,576896,654952,607719,615520,596829,586325,649302,641912,642190,624002,655573,653441,651509,651986,620250,577350,591069,572686,582816,618723,590283,644954,618764,657312,639741,646377,571053,641906,630656,591315,618078,620732,580677,651747,622121,599478,652352,598572,586899,624097,609110,637673,606300,636242,628921,622235,649592,566825,587977,631970,586196,602201,615175,631912,591089,638393,578663,601502,648845,595463,620235,601653,646912,604876,626892,606014,654323,567769,653656,648477,623411,590359,590341,568325,569838,657337,638377,586281,579394,654582,577049,645810,597867,639907,635269,658767,615779,584402,623349,654594,582272,588117,616287,638983,605661,573177,629482,607194,644025,613234,570454,629305,569094,630015,591791,594088,620537,633498,576137,603436,578890,617008,574803,657942,654484,590371,650215,638683,592659,637995,586864,629884,656821,628322,645518,577506,644903,619014,592394,620680,576558,584478,577648,574657,595321,624353,623952,657016,633052,583438,628266,652627,622698,640343,606631,653131,585495,609571,619564,607955,637977,645115,592283,619374,636493,586461,657577,598016,627700,600186,575499,603746,604162,577075,652529,653372,599873,583812,595772,607524,567228,623905,628729,630842,653363,595789,576409,620558,602800,618558,610350,587953,652831,601576,568474,624945,585899,636234,569919,656492,571362,570197,608723,601566,607385,622482,582924,606967,652893,617961,604317,643871,607020,626994,571852,653512,611089,637733,580419,614146,628047,634681,653708,598372,632729,571885,570613,635009,656540,634584,598570,634183,582080,582478,597043,575483,611194,582299,571952,618548,574644,579251,598220,605765,621231,626515,590696,599635,615297,597137,606103,604791,633396,585746,584590,571412,610316,656745,609031,580442,602838,611375,620447,590982,602125,586842,567044,611158,568599,599776,584642,593619,659082,636277,615188,599962,585043,598671,587713,586544,637709,638283,641453,589592,629879,629877,567655,638001,648033,577589,598707,597659,619586,572714,580869,573414,605357,582392,604482,641786,596159,580158,574724,626704,590243,577985,633322,616965,588306,603915,615173,611241,614415,658685,595362,597263,567269,616616,632735,616610,571724,624769,610184,570394,613945,615187,591067,623565,596179,588732,617180,569883,619419,619446,585722,566306,613892,584674,574717,587518,601661,576910,571078,591432,603530,573530,605197,572705,597497,598213,581339,614109,609494,593988,596232,570607]"
499,Conejos County Ballot Issue 1A,"[679941,680702,678977,679492,678593,678855,679595,679098,678726,680436,678968,679384,679426,678386,679390,679122,678532,679357,680706,679049,679260,679444,679504,680520,678679,679402,678862,679024,678921,679345,678900,680233,680728,679004,678654,678850,680116,680321,679829]"
0,Weld County School District RE-5J Director District A,[]
0,Weld County School District RE-5J Director District C,[]
0,City of Edgewater Mayor,[]
0,City of Cripple Creek Council - Ward 4,[]
0,Sierra Grande R-30 School District 1,[]
0,City of Englewood Office of Council Member At-Large 4,[]
0,City of Centennial Mayor,[]
0,Salida City Council Ward 1 - Four Year Term,[]
0,Centennial R-1 School District 3,[]
1476,Summit School District Director 4 Year Term,"[725315,722626,722948,730189,722433,730485,724840,726909,724011,730332,722663,722404,726361,730649,729743,723745,728855,725025,732261,724143,725834,726712,727411,728561,729666,727165,731192,732175,722620,727567,729767,730310,730398,724687,727633,728221,727853,728395,722395,729065,724412,729223,724921,727853,728001,724991,726977,729122,727656,729396,727683]"
0,Victor Council Ward 1,[]
0,Victor Council Ward 2,[]
22511,City of Boulder Ballot Question 2L,[]
1072,City and County of Broomfield - Mayor (2 Years),"[686763,696819,703553,702364,688472,703386,686214,685276,695662,701071,685527,696355,704091,697424,703058,701362,706370,706790,702372,693710,702408,702683,703528,705367,691315,692157,694078,692256,687128,697820,698419,695524,699308,690870,695731,699057,689125,705495,690295,704928,685215,696263,703239,705574,699173,703233,697085,705880,700887,703371,688543,705753,696836,701497,688138,707573,706379,693209,701974,686149,697389,705875,688771,683363,692202,690683,700138,685647,686693,686873,685667,698852,706805,687604,697589,694616,700763,705850,702913,695903,697744,697528,695581,696703,703812,700891,697281,698763,685303,707210,686647,684971,696015,685047,693623,684868,704682,706558,690639,705609,684639,697443,702536,697368,686331,685144,685632,698043,697048,700407,688323,704350,692726,693961,705648,692145,695952,697975,697524,699461,698118,698260,687985,702412,700296,702712,696632,701282,701335,702776,689663,698304,688847,683923,696725,695427,684751,688912,696433,696770,685547,692336,690077,688362,694859,688772,686468,688437,690977,690083,696046,691573,694632,692844,686220,694007,692081,686754,691580,689512,691674,683466,688658,687682,687525,689052,687136,686427]"
18288,City of Boulder Ballot Question 2M,[]
647,City of Boulder Council Candidates,[]
737,City of Brush Mayor,"[752692,753776,756684,755997,755112,755011,756105,751301,754007,754643,751292,755267,755135,751588,751607,756231,755910,756834,749952,756828,750648,751618,756403,751308,754160,752561,749765,751465,753991,751106,751322,753394,750605,751115,751148,755047,755557,752821,751132,755127,750567,749768,749791,754059,751184,753483,749682,751497,752686,756606,750878,755483,752595,756318,756961,753255,751951,754991,750389,750386,756194,752014,755107,754215,756027,749940,755370,749680,754576,754763,755359,755447,754344,753714]"
27,Town of Eagle Downtown Development Authority Ballot Issue 2B,[]
520,Town of Avon Recall Election - Mayor Sarah Smith Hymes,[]
37,Town of Vail - Council Members At-Large,[]
0,Town of Rico Board of Trustees,[]
523,Town of Avon Recall Election - Tamra Underwood,[]
128,"Town of Vail Ballot Issue 2A: Authorization of an increase of 0.5% in the Town's existing sales tax, other than on food for home",[]
261,Mountain Recreation Metropolitan District Ballot Issue 6A: Funding for the All Access Rec Program and Other District Costs.,[]
127,Telluride Town Council,[]
355,Telluride Ballot Issue 2A,[]
10,Town of Norwood Ballot Issue 2E,[]
13,City of Fort Morgan Councilmember Ward 2,[]
186,City of Fort Morgan Councilmember Ward 3,[]
578,City of Fort Morgan Ballot Question 2G,[]
0,City of Fort Morgan Councilmember Ward 1,[]
9,Morgan County Re-3 School Director,[]
0,La Junta City Utilities Commission,[]
0,City of Walsenburg City Treasurer,[]
75,City of Ouray Ballot Issue 2A,[]
42,Ouray Office of Mayor,[]
21,Hinsdale School District RE-1 Director,[]
22,City of Castle Pines Mayor,[]
0,City of Wheat Ridge Council Member District I,[]
0,Custer County School District Director 5,[]
0,City of Sheridan City Council Member Ward 1 4,[]
0,City of Sheridan City Council Member Ward 1 2,[]
0,Custer County School District Director 1,[]
0,LJC2 La Junta City Ward 2,[]
0,Salida School District Board of Education Director - At Large,[]
139,City of Thornton Council Member - Ward 4,[]
1206,Town of Castle Rock Ballot Issue 2A,[]
1339,Town of Castle Rock Ballot Issue 2D,[]
6025,Town of Castle Rock Ballot Issue 2C,[]
185,Thunderbird Water and Sanitation District Ballot Issue 6A,[]
740,City of Lone Tree Ballot Issue 2E,[]
299,City of Walsenburg Mayor,"[96422,95895,94487,95567,94764,95337,96003,96676,94741,95497,94884,96007,95738,95403,94660,96152,95739,96769,95608,94837,94989,95202,94511,95011,95360,96660,94757,95719,96042,95797,94911,94843,95699,94934,96946,94738,95169,96620,96879,96755,96875,95216,94394,95676,96741,95569,94544,96916,97009,94570,96459,96026,94924,94576,96102,96346,97028,96515,96857,96776,96577,96732,96509,94469,95985,96205,96037]"
190,City of Castle Pines - Council District 2,[]
0,CITY COUNCIL WARD 3,[]
0,CITY COUNCIL WARD 2,[]
0,Buena Vista School District Director - District B,[]
1132,City of Steamboat Springs City Council - District I - Four Year Term,"[1477067,1472812,1472818,1472487,1472273,1478373,1478901,1477499,1478564,1479498,1472012,1480439,1476289,1477921,1472621,1475217,1480104,1472320,1474942,1480018,1472176,1476774,1480607,1474842,1472517,1477820,1476711,1472734,1471498,1478831,1474921,1479292,1480176,1480620,1480254,1480928,1475595,1478197,1472330,1477077,1477925,1480618,1476083,1472129,1471631,1471957,1480145,1475897,1476695,1478881,1477083,1477604,1478108,1471858,1474861,1477637,1475216,1475337,1477035,1476110,1471820,1475294,1475328]"
759,City of Castle Pines - Council District 3,[]
63577,Referred Question 2G,[]
82430,Referred Question 2H,[]
0,City of Englewood Office of Municipal Judge,[]
0,City of Golden Council Member Ward 4,[]
0,City of Northglenn Council Member - Ward 1,[]
1075,City of Aspen Ballot Question 2B: Authorization to Exchange City Property for a Conservation Easement over the Pride of Aspen...,[]
984,City of Aspen Ballot Question 2A: Amendment to the Aspen Municipal Code regarding the Wheeler Real Estate Transfer Tax,[]
0,City of Golden Council Member Ward 1,[]
23,Redstone Ranch Acres Road General Improvement District Ballot Issue 6A:,[]
5136,Durango School District 9-R Director - District E,[]
0,City of Golden Council Member Ward 2,[]
5111,Durango School District 9-R Director - District A,[]
0,City of Golden Council Member Ward 3,[]
1089,Las Animas County Referred Measure 1A,[]
12,Hoehne Reorganized School District 3 Director District 6,[]
0,City of Centennial Council Member District 3,[]
0,City of Centennial Council Member District 2,[]
1516,City of Lakewood Council Member Ward 3,[]
1584,City of Lakewood Council Member Ward 4,[]
384,City of Edgewater Council Members,[]
17521,City of Lakewood Retention of Presiding Judge,[]
0,City of Northglenn Council Member - Ward 4 - 2 Year Term,[]
7193,City of Lakewood Ballot Issue 2D,[]
1676,City of Golden Ballot Issue 2C,[]
1142,City of Golden Ballot Issue 2B,[]
54,City of Golden Ballot Question 2A,[]
2037,RE-1 Valley School District Board of Education Director District 1,[]
2724,RE-1 Valley School District Board of Education Director District 5,[]
24,Plateau RE-5 School District Board of Directors,[]
0,Idaho Springs City Council Ward I,[]
20,Plateau RE-5 School District General Obligation Bonds Referred Ballot Issue 4B,[]
92,Stratton R-4 School District Director,"[1409468,1409796,1409755,1410007,1410450,1410122,1408791,1410149,1410332,1410206,1410278,1408883,1409206,1410376,1409968,1409584,1408416,1409745,1409824,1409064,1409092,1410349,1409660,1410411,1410099,1409742,1408430,1409073,1410134,1408453,1409257,1408612,1409213,1410064,1409478,1410053,1410342,1409644,1408633,1409110,1408589,1409159,1409433,1409759,1410343,1408904,1409606,1409225,1409938,1410385,1410449,1409634,1410116,1410076,1409845,1409338,1409309,1408596,1409546,1409780,1409171,1408941,1409252,1409112,1410229,1410055,1409398,1409309,1408538,1410435,1410052,1408686,1410406,1409778,1410257,1409069,1410030,1409958,1408517,1410350,1408786,1409703,1409438,1409330,1410139,1409507,1409036,1409100,1409705,1410003,1409715,1409303,1409175,1408853,1408563,1408522,1408985,1408556,1410374,1408552,1408542,1410242,1409681,1409756,1410181,1410336,1410002,1409368,1410342,1409812,1410353,1409822,1409397,1408550,1408622,1408960,1408800,1410142,1408518,1408828,1409982,1409462,1408884,1410054,1409336,1409597,1409794,1409016,1409995,1409067,1409744,1408506,1408692,1408887,1409017,1408437,1409538,1409662,1409041,1409030,1409660,1409097,1409526,1408508,1409221,1409461,1409290,1408991,1409165,1409031,1409008,1408466,1408760,1409172,1408982,1408813,1409017,1408407,1408792,1409141,1409086,1408820,1408992,1408689,1408423]"
190,Highland Park Sanitation District Referred Ballot Question 6M,[]
70,Town of Elizabeth Ballot Question 2A,[]
190,Kiowa C-2 School District Director - 2 Year Term,[]
57,Kiowa C-2 School District Director - 4 Year Term,[]
0,Vote for not more than TWO (2) Directors to act until the first regular election in 2022.                                ,[]
1015,Berthoud Community Library District Ballot Issue 6D,[]
0,City of Canon City Council Member - At-Large,[]
0,City of Las Animas Mayor,[]
41,Larimer County Eagle Crest Public Improvement District No. 74 Ballot Issue 6C,[]
2248,Eagle County Ballot Issue 1A,"[81564,84748,85875,86815,82331,85312,74705,74953,78459,81527,82968,81238,76461,78838,84251,87735,75440,86950,74295,84160,83478,85807,73929,81066,73215,78853,73965,73824,87535,78309,82701,75762,85612,82465,81733,84674,86247,86047,73733,85201,79234,85552,82973,83699,77920,81470,73022,81593,77418,79068,77368,77843]"
291,City of Loveland Mayor,[]
2,City of Idaho Springs Ballot Question 2B,[]
75,Garfield County School District 16,[]
0,City of Louisville City Council Ward 3 (4-year term),[]
2134,Colorado River Fire Protection District Ballot Issue 6A,[]
460,Northern Saguache County Library District Ballot Issue 6B,[]
1228,Grand County Ballot Question 1E,[]
1011,Grand County Ballot Question 1F,[]
0,Adams 12 Five Star Schools School Director District No. 4,[]
1209,East Grand School District No. 2 Director - District 3,[]
0,City of Alamosa Mayor,[]
2514,Proposed Colorado Springs Briargate General Improvement District 2021 Ballot Issue 6B,[]
472,Colorado Springs School District 11 Director - 4 Year Term,[]
179,Widefield School District 3 Director - 4 Year Term,[]
802,El Paso County Colorado School District 49 Director District 5 - 4 Year Term,[]
903,El Paso County School District No. 2 Director District 1 - 4 Year Term,[]
213,City of Fountain Mayor - 4 Year Term,[]
151,City of Manitou Springs City Council - Ward 3 - 4 Year Term,[]
0,City of Louisville City Council Ward 2 (4-year term),[]
530,City of Manitou Springs Mayor,[]
1686,Cheyenne Mountain School District 12 Director - 4 Year Term,[]
1122,El Paso County Colorado School District 49 Director District 1 - 4 Year Term,[]
16648,El Paso County Ballot Issue 1A,[]
381,City of Fountain Council Member Ward 3 - 4 Year Term,[]
6166,Academy School District 20 Director - 4 Year,[]
0,Director for Montrose County Board of Education - District A,[]
0,Director for Montrose County Board of Education - District G,[]
0,Wray City Council,[]
933,Garfield School No. Re-2 School Board Director E,"[1422283,1423551,1416206,1425844,1417719,1425477,1429544,1416766,1427319,1424472,1426462,1419810,1428705,1425608,1426570,1424496,1427726,1431002,1428884,1416147,1417405,1425024,1421131,1427464,1425666,1431096,1425508,1421701,1422788,1426553,1425426,1422678,1425735,1423362,1427978,1415748,1430033,1416129,1423690,1426180,1420985,1429024,1427863,1417571,1429933,1424393,1428533,1426984,1416297,1423402,1427454,1419521,1421210,1429470,1430286,1419292,1419891,1428137,1418617,1424171,1429296,1422977,1429505,1421461,1420479,1422354,1416972,1425814,1421889,1418777,1423442,1425704,1427178,1427623,1427823,1429588,1430127,1422328,1429836,1423784,1420419,1428358,1418385,1422470,1425192,1418994,1427482,1418887,1427924,1421089,1425435,1424112,1424724,1424282,1419323,1418857,1423093,1422607,1420139,1423317,1420243,1420471,1416937,1418444,1419900,1423496,1421693,1419367,1422949,1423434,1417412,1421372,1421870,1418039,1416297,1416582,1417134,1416261,1418334,1418327,1416412,1416179]"
0,RE-1 Valley School District Board of Education Director District 2,[]
10876,El Paso County Colorado School District 49 Ballot Issue 4A,[]
375,Manitou Springs School District No. 14 Ballot Issue 4C,[]
0,RE-1 Valley School District Board of Education Director District 6,[]
928,Montezuma School District Director-District E,"[874403,868470,876560,867185,868446,865162,871216,875172,871221,879123,865452,868538,867616,866249,874296,870388,865455,866482,869831,873398,878902,867868,876389,877102,870187,866592,869081,877452,865348,871057,866637,874818,867144,875265,877471,865790,869635,878022,873764,867148,874087,874819,877657,875188,875438,877640,871220,878219,878381,875757,872812,875425,866140,873848,873549,872209,871462,871621,870184,866001,872333,871013,869606]"
135,Lincoln - Proposition 120 (STATUTORY),"[91636,92696,92754,91670,92200,92299,92751,92047,92230,92386,92436,91880,91391,92431,92580,92737,91349,92640,91512,92537,92141,91463,92272,92818,92535,91721,91451,92651,91348,91731,92242,92036,92061,92545,92307,92623,92631,92298,92439,91929,92597,91927,91432,91589,92551,91990,92293,91294,91381,91888,92456,91549,92768,92256,91320,92270,92013,91990,91861,91575,91381,91962,92313,92332,92399,92213,91299,92036,92005,92017,92223,92237,91874,91680,91569,91971,92013,91761,91903,92027,91796,91977,91792,91297,91513]"
7758,City of Colorado Springs Ballot Issue 2C,[]
17479,City of Colorado Springs Ballot Issue 2D,[]
9,Colorado Springs School District 11 Ballot Issue 4B,[]
1987,Security Fire Protection District Ballot Issue 6A,[]
955,El Paso County Colorado School District 49 Director District 4 - 2 Year Term,[]
0,School Board Director- 4 Year,[]
558,Town of Monument Ballot Issue 2E,[]
809,Town of Monument Ballot Issue 2F,[]
114,City of Fountain Council Member Ward 1 - 4 Year Term,[]
44,Hanover School District 28 Director - 4 Year Term,[]
41,Town of Calhan Ballot Issue 2B,[]
90,Fountain-Fort Carson School District 8 Director - 4 Year Term,[]
718,Town of Monument Ballot Question 2G,[]
0,Center Consolidated School District 26 JT Director - District B,[]
3,Town of Ramah Ballot Issue 2A,[]
650,Ellicott School District 22 Director - 4 Year Term,[]
0,Idaho Springs City Council Ward II,[]
11,Monte Vista School District C-8 Board of Education Director-Four Year Term,[]
5,Upper Rio Grande School District C-7 Director-Four Year Term,[]
46,City of Littleton Council Member District I,[]
0,City of Fountain Council Member At Large - 4 Year Term,[]
2211,City of Englewood Office of Council Member At-Large 2,[]
914,City of Centennial Council Member District 1,[]
173,City of Centennial Council Member District 4,[]
113,Town of Deer Trail Ballot Issue 2A,[]
5287,Arapahoe Park and Recreation District Ballot Issue 6A,[]
28,City of Sheridan Council Member Ward 3,[]
0,Montezuma School District Director-District F,[]
0,Montezuma School District Director-District D,[]
0,Montezuma School District Director-District G,[]
82143,Arapahoe County Ballot Issue 1A,[]
0,Montezuma School District Director-District B,[]
0,Montezuma School District Director-District A,[]
83,Englewood Downtown Development Authority Ballot Issue 6D,[]
21,Proposed Southmoor Hudson GID Ballot Question 6B,[]
13115,School Board Director - District D,[]
0,Weld County School District RE-2 Director District A,[]
1341,Mesa County Valley School District 51 - Director District C,"[14865,65153,32328,39121,49939,14225,49563,42280,49214,63243,38777,56215,28238,30107,64220,44690,52594,15104,51524,40989,51216,32223,62201,53344,13033,38720,45379,56203,60601,41595,54694,16267,55148,55146,61718,29467,36152,57619,61852,40425,63464,46614,21472,47866,52976,46603,24547,37523,13489,63486,45238,16314,21938,62684,22596,39835,30788,23342,38110,56135,41081,48887,55422,42631,39261,55029,62559,59559,38522,64520,13245,48842,42352,53798,64275,20698,63337,24362,42976,39196,63522,54124,44969,20633,53711,24895,44819,65171,42608,62433,64170,57465,16550,35265,28961,33938,19151,52020,54179,12894,17333,36726,41620,49004,19756,64388,30360,34467,49361,46785,26231,34996,37118,64945,54248,38847,62137,61915,47766,54071,21826,43837,47197,64966,54029,57332,62046,31281,13149,46240,57753,37948,33912,46853,17215,22206,28850,31113,60145,63031,64494,21231,50967,48355,39419,37085,63459,62411,22155,42216,47961,58494,23594,58729,35174,53632,15146,30779,41514,30679,28330,56620,20091,35470,21700,42769,40707,42542,61003,60776,37966,28669,30098,64996,49138,53981,45481,55472,24262,49264,18545,35896,51121,51221,28075,55299,41272,60467,63172,19822,61318,26561,52440,58833,37189,50568,35156,25646,35858,40975,41672,17515,43267,25053,20362,48519,51522,28524,28785,36056,32364,57163,36907,41837,47632,32309,22149,47670,48256,38751,42162,39947,38998,28864,25065,41486,44904,20212,19112,12787,24729,39675,26450,32688,42658,40154,14296,27572,13077,17765,26286,33386,39544,33116,36061,26778,29312,33013,24200,38375,25990,40743,20644,31601,26925,18407,20948,12899,18788,25065,20734,49238,33892,26978,32029,26909,15273,26005,24115,25307,21293,18087,57065,23822,57114,19110,17132,21814,14774,49301,18821,57229,14098,16894,15132,13604,13278]"
13814,School Board Director - District E,[]
123,Director District C 4 Year Term,"[676904,677016,677041,677362,676997,677294,677161,676902,677434,676954,676859,677190,677031,676937,677315,677241,676973,677392,677242,676990,677369,677458,677206,676961,677343,677402,676941,676872,677386,677172,677411,677368,676857,676876,677257,677114,677202,677203,677170]"
128,City of Aurora Council Member Ward III,[]
284,City of Englewood Office of Council Member District 4,[]
171,City of Greenwood Village Councilmember District 2,[]
632,City of Greenwood Village Councilmember District 1,[]
15,City of Greenwood Village Councilmember District 4,[]
21,Proposed Southmoor Hudson GID Ballot Issue 6C,[]
361,City of Greenwood Village Councilmember District 3,[]
14,City of Sheridan City Council Member Ward 2,[]
36,Englewood School District School Board Director 4,[]
2463,City of Greenwood Village Ballot Question 2B,[]
83,Town Council 4,[]
0,City of Salida Mayor - Two Year Term,[]
0,Council Member - At Large,[]
0,Moffat County School Board Director - At Large,[]
0,City of Canon City Council Member - District 3,[]
0,City of Brighton Councilmember Ward 2,[]
0,City of Brighton Councilmember Ward 3,[]
0,City of Brighton Councilmember Ward 4,[]
